{
  "id": "med-intake-001-phonephoto",
  "page_width": 644.6,
  "page_height": 817.0,
  "blanks": [
    {
      "id": "b001",
      "x": 71.4,
      "y": 102.5,
      "width": 216.5,
      "height": 25.0,
      "type": "name",
      "confidence": 1.0,
      "rows": null
    },
    {
      "id": "b002",
      "x": 316.0,
      "y": 112.8,
      "width": 94.2,
      "height": 19.9,
      "type": "date",
      "confidence": 1.0,
      "rows": null
    },
    {
      "id": "b003",
      "x": 431.1,
      "y": 117.6,
      "width": 72.6,
      "height": 19.0,
      "type": "single_line",
      "confidence": 1.0,
      "rows": null
    },
    {
      "id": "b004",
      "x": 70.4,
      "y": 127.7,
      "width": 216.5,
      "height": 25.0,
      "type": "single_line",
      "confidence": 1.0,
      "rows": null
    },
    {
      "id": "b005",
      "x": 315.0,
      "y": 138.0,
      "width": 187.7,
      "height": 23.8,
      "type": "single_line",
      "confidence": 1.0,
      "rows": null
    },
    {
      "id": "b006",
      "x": 66.2,
      "y": 185.3,
      "width": 477.2,
      "height": 77.4,
      "type": "large_paragraph",
      "confidence": 1.0,
      "rows": 2
    },
    {
      "id": "b007",
      "x": 64.2,
      "y": 282.4,
      "width": 10.4,
      "height": 10.4,
      "type": "checkbox",
      "confidence": 1.0,
      "rows": null
    },
    {
      "id": "b008",
      "x": 229.6,
      "y": 289.3,
      "width": 10.4,
      "height": 10.4,
      "type": "checkbox",
      "confidence": 1.0,
      "rows": null
    },
    {
      "id": "b009",
      "x": 395.1,
      "y": 296.2,
      "width": 10.4,
      "height": 10.4,
      "type": "checkbox",
      "confidence": 1.0,
      "rows": null
    },
    {
      "id": "b010",
      "x": 63.1,
      "y": 307.6,
      "width": 10.4,
      "height": 10.4,
      "type": "checkbox",
      "confidence": 1.0,
      "rows": null
    },
    {
      "id": "b011",
      "x": 228.6,
      "y": 314.5,
      "width": 10.4,
      "height": 10.4,
      "type": "checkbox",
      "confidence": 1.0,
      "rows": null
    },
    {
      "id": "b012",
      "x": 394.0,
      "y": 321.4,
      "width": 10.4,
      "height": 10.4,
      "type": "checkbox",
      "confidence": 1.0,
      "rows": null
    },
    {
      "id": "b013",
      "x": 59.3,
      "y": 372.3,
      "width": 202.9,
      "height": 44.4,
      "type": "signature",
      "confidence": 1.0,
      "rows": null
    },
    {
      "id": "b014",
      "x": 289.4,
      "y": 403.5,
      "width": 101.4,
      "height": 20.2,
      "type": "date",
      "confidence": 1.0,
      "rows": null
    }
  ]
}