{
  "id": "hr-onboarding-001-folded",
  "page_width": 612.0,
  "page_height": 792.0,
  "blanks": [
    {
      "id": "b001",
      "x": 43.2,
      "y": 68.4,
      "width": 216.0,
      "height": 16,
      "type": "name",
      "confidence": 1.0,
      "rows": null
    },
    {
      "id": "b002",
      "x": 288.0,
      "y": 68.4,
      "width": 100.8,
      "height": 16,
      "type": "date",
      "confidence": 1.0,
      "rows": null
    },
    {
      "id": "b003",
      "x": 403.2,
      "y": 68.4,
      "width": 72.0,
      "height": 16,
      "type": "single_line",
      "confidence": 1.0,
      "rows": null
    },
    {
      "id": "b004",
      "x": 43.2,
      "y": 129.6,
      "width": 10,
      "height": 10,
      "type": "checkbox",
      "confidence": 1.0,
      "rows": null
    },
    {
      "id": "b005",
      "x": 208.8,
      "y": 129.6,
      "width": 10,
      "height": 10,
      "type": "checkbox",
      "confidence": 1.0,
      "rows": null
    },
    {
      "id": "b006",
      "x": 374.4,
      "y": 129.6,
      "width": 10,
      "height": 10,
      "type": "checkbox",
      "confidence": 1.0,
      "rows": null
    },
    {
      "id": "b007",
      "x": 43.2,
      "y": 154.8,
      "width": 10,
      "height": 10,
      "type": "checkbox",
      "confidence": 1.0,
      "rows": null
    },
    {
      "id": "b008",
      "x": 208.8,
      "y": 154.8,
      "width": 10,
      "height": 10,
      "type": "checkbox",
      "confidence": 1.0,
      "rows": null
    },
    {
      "id": "b009",
      "x": 374.4,
      "y": 154.8,
      "width": 10,
      "height": 10,
      "type": "checkbox",
      "confidence": 1.0,
      "rows": null
    },
    {
      "id": "b010",
      "x": 43.2,
      "y": 234.0,
      "width": 151.2,
      "height": 21.6,
      "type": "table_cell",
      "confidence": 1.0,
      "rows": null
    },
    {
      "id": "b011",
      "x": 208.8,
      "y": 234.0,
      "width": 151.2,
      "height": 21.6,
      "type": "table_cell",
      "confidence": 1.0,
      "rows": null
    },
    {
      "id": "b012",
      "x": 374.4,
      "y": 234.0,
      "width": 151.2,
      "height": 21.6,
      "type": "table_cell",
      "confidence": 1.0,
      "rows": null
    },
    {
      "id": "b013",
      "x": 43.2,
      "y": 298.8,
      "width": 201.6,
      "height": 36.0,
      "type": "signature",
      "confidence": 1.0,
      "rows": null
    },
    {
      "id": "b014",
      "x": 273.6,
      "y": 320.4,
      "width": 100.8,
      "height": 16,
      "type": "date",
      "confidence": 1.0,
      "rows": null
    }
  ]
}