{
  "id": "edu-algebra-worksheet-001-rot7",
  "page_width": 702.2,
  "page_height": 859.2,
  "blanks": [
    {
      "id": "b001",
      "x": 78.0,
      "y": 99.3,
      "width": 137.7,
      "height": 32.1,
      "type": "name",
      "confidence": 1.0,
      "rows": null
    },
    {
      "id": "b002",
      "x": 281.8,
      "y": 82.7,
      "width": 73.4,
      "height": 24.4,
      "type": "date",
      "confidence": 1.0,
      "rows": null
    },
    {
      "id": "b003",
      "x": 417.6,
      "y": 69.9,
      "width": 44.8,
      "height": 21.0,
      "type": "single_line",
      "confidence": 1.0,
      "rows": null
    },
    {
      "id": "b004",
      "x": 254.5,
      "y": 116.1,
      "width": 173.5,
      "height": 36.3,
      "type": "single_line",
      "confidence": 1.0,
      "rows": null
    },
    {
      "id": "b005",
      "x": 258.8,
      "y": 151.9,
      "width": 173.5,
      "height": 36.3,
      "type": "single_line",
      "confidence": 1.0,
      "rows": null
    },
    {
      "id": "b006",
      "x": 263.1,
      "y": 187.6,
      "width": 173.5,
      "height": 36.3,
      "type": "single_line",
      "confidence": 1.0,
      "rows": null
    },
    {
      "id": "b007",
      "x": 267.3,
      "y": 223.4,
      "width": 173.5,
      "height": 36.3,
      "type": "single_line",
      "confidence": 1.0,
      "rows": null
    },
    {
      "id": "b008",
      "x": 74.4,
      "y": 269.6,
      "width": 506.9,
      "height": 173.2,
      "type": "multi_line",
      "confidence": 1.0,
      "rows": 5
    }
  ]
}